4173,,ゴムカズラ,,Urceola micrantha (Wall. ex G.Don) D.J.Middleton,354,キョウチクトウ科,Apocynaceae,,キョウチクトウ科
4195,,クサタチバナ,,Vincetoxicum acuminatum Decne.,354,キョウチクトウ科,Apocynaceae,,ガガイモ科
4196,,アオカモメヅル,,Vincetoxicum ambiguum Maxim.,354,キョウチクトウ科,Apocynaceae,固有,ガガイモ科
4197,,ロクオンソウ,ヒゴビャクゼン,Vincetoxicum amplexicaule Siebold et Zucc.,354,キョウチクトウ科,Apocynaceae,,ガガイモ科
4198,f,クロバナロクオンソウ,,Vincetoxicum amplexicaule Siebold et Zucc. f. castaneum (Makino) Kitag.,354,キョウチクトウ科,Apocynaceae,固有,ガガイモ科
4199,,フナバラソウ,,Vincetoxicum atratum (Bunge) C.Morren et Decne.,354,キョウチクトウ科,Apocynaceae,,ガガイモ科
4200,f,アオフナバラソウ,,Vincetoxicum atratum (Bunge) C.Morren et Decne. f. viridescens (H.Hara) Sugim.,354,キョウチクトウ科,Apocynaceae,,ガガイモ科
4201,,ナンゴクカモメヅル,,Vincetoxicum austrokiusianum (Koidz.) Kitag.,354,キョウチクトウ科,Apocynaceae,固有,ガガイモ科
4202,,イシダテクサタチバナ,,Vincetoxicum calcareum (H.Ohashi) Liede,354,キョウチクトウ科,Apocynaceae,固有,ガガイモ科
4203,,サツマビャクゼン,,Vincetoxicum doianum (Koidz.) Kitag.,354,キョウチクトウ科,Apocynaceae,固有,ガガイモ科
4204,f,アオタチカモメヅル,,Vincetoxicum glabrum (Nakai) Kitag. f. viridescens (Murata) Sugim.,354,キョウチクトウ科,Apocynaceae,固有,ガガイモ科
4205,,タチカモメヅル,クロバナカモメヅル,Vincetoxicum glabrum (Nakai) Kitag. var. glabrum,354,キョウチクトウ科,Apocynaceae,固有,ガガイモ科
4206,,マルバカモメヅル,,Vincetoxicum glabrum (Nakai) Kitag. var. rotundifolium (Honda) Sugim. ex Yonek.,354,キョウチクトウ科,Apocynaceae,固有,ガガイモ科
4207,,ホウヨカモメヅル,,Vincetoxicum hoyoense T.Yamash.,354,キョウチクトウ科,Apocynaceae,,ガガイモ科
4208,,エゾノクサタチバナ,,Vincetoxicum inamoenum Maxim.,354,キョウチクトウ科,Apocynaceae,,ガガイモ科
4209,,イズカモメヅル,,Vincetoxicum izuense T.Yamash.,354,キョウチクトウ科,Apocynaceae,,ガガイモ科
4210,f,マルバオゴケ,,Vincetoxicum japonicum C.Morren et Decne. f. maritimum Sugim.,354,キョウチクトウ科,Apocynaceae,固有,ガガイモ科
4211,,シロバナクサタチバナ,ビロードイヨカズラ,Vincetoxicum japonicum C.Morren et Decne. var. albiflorum (Franch. et Sav.) Kitag.,354,キョウチクトウ科,Apocynaceae,固有,ガガイモ科
4212,f,クロバナイヨカズラ,クロバナノイヨカズラ，ムラサキクサタチバナ,Vincetoxicum japonicum C.Morren et Decne. var. albiflorum (Franch. et Sav.) Kitag. f. puncticlatum (Koidz.) Kitag.,354,キョウチクトウ科,Apocynaceae,固有,ガガイモ科
4213,,イヨカズラ,スズメノオゴケ,Vincetoxicum japonicum C.Morren et Decne. var. japonicum,354,キョウチクトウ科,Apocynaceae,,ガガイモ科
4214,,クサナギオゴケ,,Vincetoxicum katoi (Ohwi) Kitag.,354,キョウチクトウ科,Apocynaceae,固有,ガガイモ科
4215,f,シロバナクサナギオゴケ,,Vincetoxicum katoi (Ohwi) Kitag. f. albescens (H.Hara) Kitag.,354,キョウチクトウ科,Apocynaceae,固有,ガガイモ科
4216,,マルバノフナバラソウ,,Vincetoxicum krameri Franch. et Sav.,354,キョウチクトウ科,Apocynaceae,固有,ガガイモ科
4217,,ツクシガシワ,オオタチガシワ,Vincetoxicum macrophyllum Siebold et Zucc.,354,キョウチクトウ科,Apocynaceae,固有,ガガイモ科
4218,,ツルガシワ,オオツルガシワ,Vincetoxicum macrophyllum Siebold et Zucc. var. nikoense Maxim.,354,キョウチクトウ科,Apocynaceae,固有,ガガイモ科
4219,,タチガシワ,,Vincetoxicum magnificum (Nakai) Kitag.,354,キョウチクトウ科,Apocynaceae,固有,ガガイモ科
4220,,ホソバノロクオンソウ,,Vincetoxicum multinerve Franch. et Sav.,354,キョウチクトウ科,Apocynaceae,固有,ガガイモ科
4221,,アキノクサタチバナ,オオツルガシワ,Vincetoxicum multinerve Franch. et Sav. var. kiyohikoanum (Honda) Kitag.,354,キョウチクトウ科,Apocynaceae,固有,ガガイモ科
4222,,オオアオカモメヅル,,Vincetoxicum nipponicum (Matsum.) Kitag.,354,キョウチクトウ科,Apocynaceae,固有,ガガイモ科
4223,f,ナガバクロカモメヅル,,Vincetoxicum nipponicum (Matsum.) Kitag. f. abukumense (Koidz.) Kitag.,354,キョウチクトウ科,Apocynaceae,,ガガイモ科
4224,,スズサイコ,,Vincetoxicum pycnostelma Kitag.,354,キョウチクトウ科,Apocynaceae,,ガガイモ科
4225,f,ヒロハスズサイコ,,Vincetoxicum pycnostelma Kitag. f. latifolium (Makino) Kitag.,354,キョウチクトウ科,Apocynaceae,,ガガイモ科
4226,,アズマカモメヅル,,Vincetoxicum sublanceolatum (Miq.) Maxim. var. albiflorum (Franch. et Sav.) Kitag.,354,キョウチクトウ科,Apocynaceae,固有,ガガイモ科
4227,,ジョウシュウカモメヅル,,Vincetoxicum sublanceolatum (Miq.) Maxim. var. auriculatum Franch. et Sav.,354,キョウチクトウ科,Apocynaceae,固有,ガガイモ科
4228,,キノクニカモメヅル,,Vincetoxicum sublanceolatum (Miq.) Maxim. var. kinokuniense (T.Yamaz.) Yonek.,354,キョウチクトウ科,Apocynaceae,固有,ガガイモ科
4229,,シロバナカモメヅル,オオバナカモメヅル，イワキカモメヅル，タイリンカモメヅル,Vincetoxicum sublanceolatum (Miq.) Maxim. var. macranthum Maxim.,354,キョウチクトウ科,Apocynaceae,固有,ガガイモ科
4230,f,イワキカモメヅル,,Vincetoxicum sublanceolatum (Miq.) Maxim. var. macranthum Maxim. f. yesoense (Nakai) Kitag.,354,キョウチクトウ科,Apocynaceae,,ガガイモ科
4231,,コバノカモメヅル,,Vincetoxicum sublanceolatum (Miq.) Maxim. var. sublanceolatum,354,キョウチクトウ科,Apocynaceae,固有,ガガイモ科
4232,h,ムラサキスズメノオゴケ,ミウラスズメノオゴケ,Vincetoxicum x purpurascens C.Morren et Decne.,354,キョウチクトウ科,Apocynaceae,,ガガイモ科
4233,h,ミヤマフナバラソウ,,Vincetoxicum x sakaianum (Honda) Kitag.,354,キョウチクトウ科,Apocynaceae,,ガガイモ科
4234,h,ミウラスズメノオゴケ,,Vincetoxicum x vernyi Franch. et Sav.,354,キョウチクトウ科,Apocynaceae,固有,ガガイモ科
4235,,ヤマワキオゴケ,,Vincetoxicum yamanakae (Ohwi et H.Ohashi) H.Ohashi,354,キョウチクトウ科,Apocynaceae,固有,ガガイモ科
4236,,ヨナグニカモメヅル,ヨナクニカモメヅル,Vincetoxicum yonakuniense (Hatus.) T.Yamash. et T.Tateishi,354,キョウチクトウ科,Apocynaceae,固有,ガガイモ科
4406,,サワルリソウ,,Ancistrocarya japonica Maxim.,356,ムラサキ科,Boraginaceae,固有,ムラサキ科
4407,f,シロバナサワルリソウ,,Ancistrocarya japonica Maxim. f. albiflora (Honda) H.Hara,356,ムラサキ科,Boraginaceae,,ムラサキ科
4408,,ハナイバナ,,Bothriospermum zeylanicum (J.Jacq.) Druce,356,ムラサキ科,Boraginaceae,,ムラサキ科
4409,,トゲミノイヌチシャ,トゲミイヌジシャ,Cordia aspera G.Forst. subsp. kanehirae (Hayata) H.Y.Liu,356,ムラサキ科,Boraginaceae,,ムラサキ科
4410,,カキバチシャノキ,イヌヂシャ,Cordia dichotoma G.Forst.,356,ムラサキ科,Boraginaceae,,ムラサキ科
4411,,オニルリソウ,エゾオニルリソウ，トサルリソウ,Cynoglossum asperrimum Nakai,356,ムラサキ科,Boraginaceae,,ムラサキ科
4412,,オオルリソウ,,Cynoglossum furcatum Wall. var. villosulum (Nakai) Riedl,356,ムラサキ科,Boraginaceae,,ムラサキ科
4413,f,シロバナオオルリソウ,,Cynoglossum furcatum Wall. var. villosulum (Nakai) Riedl f. albiflorum (H.Hara) Yonek.,356,ムラサキ科,Boraginaceae,,ムラサキ科
4414,,タイワンルリソウ,シマスナビキソウ,Cynoglossum lanceolatum Forssk. var. formosanum (Nakai) H.Hara,356,ムラサキ科,Boraginaceae,,ムラサキ科
4415,f,シロバナシマルリソウ,,Cynoglossum lanceolatum Forssk. var. formosanum (Nakai) H.Hara f. albiflorum (Masam.) Yonek.,356,ムラサキ科,Boraginaceae,,ムラサキ科
4416,,チシャノキ,カキノキダマシ，ヒロハチシャノキ,Ehretia acuminata R.Br. var. obovata (Lindl.) I.M.Johnst.,356,ムラサキ科,Boraginaceae,,ムラサキ科
4417,,マルバチシャノキ,オオバチシャノキ,Ehretia dicksonii Hance,356,ムラサキ科,Boraginaceae,,ムラサキ科
4418,,フクマンギ,,Ehretia microphylla Lam.,356,ムラサキ科,Boraginaceae,,ムラサキ科
4419,,リュウキュウチシャノキ,ヤエヤマチシャノキ,Ehretia philippinensis A.DC.,356,ムラサキ科,Boraginaceae,,ムラサキ科
4420,,シロバナエゾルリムラサキ,シロバナミヤマムラサキ,Eritrichium nipponicum Makino var. albiflorum Koidz. f. albiflorum (Koidz.) H.Hara,356,ムラサキ科,Boraginaceae,,ムラサキ科
4421,,エゾルリムラサキ,,Eritrichium nipponicum Makino var. albiflorum Koidz. f. yesoense H.Hara,356,ムラサキ科,Boraginaceae,,ムラサキ科
4422,,ミヤマムラサキ,,Eritrichium nipponicum Makino var. nipponicum,356,ムラサキ科,Boraginaceae,,ムラサキ科
4423,,イワムラサキ,オカムラサキ，カラフトイワムラサキ,Hackelia deflexa (Wahlenb.) Opiz,356,ムラサキ科,Boraginaceae,,ムラサキ科
4424,,モンパノキ,ハマムラサキノキ,Heliotropium foertherianum Diane et Hilger,356,ムラサキ科,Boraginaceae,,ムラサキ科
4425,,スナビキソウ,ハマムラサキ,Heliotropium japonicum A.Gray,356,ムラサキ科,Boraginaceae,,ムラサキ科
4426,,ムラサキ,,Lithospermum erythrorhizon Siebold et Zucc.,356,ムラサキ科,Boraginaceae,,ムラサキ科
4427,,ホタルカズラ,,Lithospermum zollingeri A.DC.,356,ムラサキ科,Boraginaceae,,ムラサキ科
4428,f,シロバナホタルカズラ,,Lithospermum zollingeri A.DC. f. albidum (Honda) H.Hara,356,ムラサキ科,Boraginaceae,,ムラサキ科
4429,,ハマベンケイソウ,,Mertensia maritima (L.) Gray subsp. asiatica Takeda,356,ムラサキ科,Boraginaceae,,ムラサキ科
4430,f,シロバナハマベンケイソウ,,Mertensia maritima (L.) Gray subsp. asiatica Takeda f. albiflora H.Hara,356,ムラサキ科,Boraginaceae,,ムラサキ科
4431,,チシマルリソウ,,Mertensia pterocarpa (Turcz.) Tatew. et Ohwi var. pterocarpa,356,ムラサキ科,Boraginaceae,,ムラサキ科
4432,f,ポロスルリソウ,,Mertensia pterocarpa (Turcz.) Tatew. et Ohwi var. pterocarpa f. yoshimurae T.Fukuda et Hideki Takah.,356,ムラサキ科,Boraginaceae,,ムラサキ科
4433,,エゾルリソウ,イワルリソウ,Mertensia pterocarpa (Turcz.) Tatew. et Ohwi var. yezoensis Tatew. et Ohwi,356,ムラサキ科,Boraginaceae,固有,ムラサキ科
4434,,エゾムラサキ,ミヤマワスレナソウ，ミヤマワスレナグサ,Myosotis sylvatica Hoffm.,356,ムラサキ科,Boraginaceae,,ムラサキ科
4435,,アキノハイルリソウ,,Omphalodes akiensis Kadota,356,ムラサキ科,Boraginaceae,,ムラサキ科
4436,,シロバナアキノハイルリソウ,,Omphalodes akiensis Kadota f. albiflora Kadota,356,ムラサキ科,Boraginaceae,,ムラサキ科
4437,f,シロバナヤマルリソウ,,Omphalodes japonica (Thunb.) Maxim. f. albiflora S.Okamoto ex H.Hara,356,ムラサキ科,Boraginaceae,,ムラサキ科
4438,,トゲヤマルリソウ,,Omphalodes japonica (Thunb.) Maxim. var. echinosperma Kitam.,356,ムラサキ科,Boraginaceae,固有,ムラサキ科
4439,,ヤマルリソウ,,Omphalodes japonica (Thunb.) Maxim. var. japonica,356,ムラサキ科,Boraginaceae,固有,ムラサキ科
4440,f,シロバナルリソウ,ハリソウ,Omphalodes krameri Franch. et Sav. f. alba (T.It?) H.Hara,356,ムラサキ科,Boraginaceae,,ムラサキ科
4441,,ルリソウ,,Omphalodes krameri Franch. et Sav. var. krameri,356,ムラサキ科,Boraginaceae,固有,ムラサキ科
4442,,エチゴルリソウ,,Omphalodes krameri Franch. et Sav. var. laevisperma (Nakai) Ohwi,356,ムラサキ科,Boraginaceae,固有,ムラサキ科
4443,f,シロバナエチゴルリソウ,,Omphalodes krameri Franch. et Sav. var. laevisperma (Nakai) Ohwi f. leucantha Yonek.,356,ムラサキ科,Boraginaceae,,ムラサキ科
4444,,ハイルリソウ,,Omphalodes prolifera Ohwi,356,ムラサキ科,Boraginaceae,固有,ムラサキ科
4445,,ミズタビラコ,,Trigonotis brevipes (Maxim.) Maxim. ex Hemsl. var. brevipes,356,ムラサキ科,Boraginaceae,固有,ムラサキ科
4446,,コシジタビラコ,,Trigonotis brevipes (Maxim.) Maxim. ex Hemsl. var. coronata (Ohwi) Ohwi,356,ムラサキ科,Boraginaceae,固有,ムラサキ科
4447,,タチカメバソウ,,Trigonotis guilielmii (A.Gray) A.Gray ex G?rke,356,ムラサキ科,Boraginaceae,固有,ムラサキ科
4448,,ツルカメバソウ,,Trigonotis iinumae (Maxim.) Makino,356,ムラサキ科,Boraginaceae,固有,ムラサキ科
4449,,キュウリグサ,タビラコ,Trigonotis peduncularis (Trevir.) Steven ex Palib.,356,ムラサキ科,Boraginaceae,,ムラサキ科
4450,,ケルリソウ,ケカメバソウ，タイリンカメバソウ,Trigonotis radicans (Turcz.) Steven var. radicans,356,ムラサキ科,Boraginaceae,,ムラサキ科
4451,,チョウセンカメバソウ,オオカメバソウ，キヌゲカメバソウ,Trigonotis radicans (Turcz.) Steven var. sericea (Maxim.) H.Hara,356,ムラサキ科,Boraginaceae,,ムラサキ科
4379,,ナガバアサガオ,ホソヒルガオ,Aniseia martinicensis (Jacq.) Choisy,357,ヒルガオ科,Convolvulaceae,,ヒルガオ科
4380,,コヒルガオ,,Calystegia hederacea Wall.,357,ヒルガオ科,Convolvulaceae,,ヒルガオ科
4381,f,シロバナコヒルガオ,,Calystegia hederacea Wall. f. sakuraii Hiyama,357,ヒルガオ科,Convolvulaceae,,ヒルガオ科
4382,h,アイノコヒルガオ,,Calystegia hederacea Wall. x C. pubescens Lindl.,357,ヒルガオ科,Convolvulaceae,,ヒルガオ科
4383,,ヒルガオ,,Calystegia pubescens Lindl.,357,ヒルガオ科,Convolvulaceae,,ヒルガオ科
4384,f,シロバナヒルガオ,,Calystegia pubescens Lindl. f. albiflora (Makino) Yonek.,357,ヒルガオ科,Convolvulaceae,,ヒルガオ科
4385,,ハマヒルガオ,,Calystegia soldanella (L.) R.Br.,357,ヒルガオ科,Convolvulaceae,,ヒルガオ科
4386,f,シロバナハマヒルガオ,,Calystegia soldanella (L.) R.Br. f. albiflora H.Hara,357,ヒルガオ科,Convolvulaceae,,ヒルガオ科
4387,f,ベニバナハマヒルガオ,,Calystegia soldanella (L.) R.Br. f. rubriflora Asai,357,ヒルガオ科,Convolvulaceae,,ヒルガオ科
4388,,マメダオシ,,Cuscuta australis R.Br.,357,ヒルガオ科,Convolvulaceae,,ヒルガオ科
4389,,ハマネナシカズラ,,Cuscuta chinensis Lam.,357,ヒルガオ科,Convolvulaceae,,ヒルガオ科
4390,,クシロネナシカズラ,,Cuscuta europaea L.,357,ヒルガオ科,Convolvulaceae,,ヒルガオ科
4391,,ネナシカズラ,,Cuscuta japonica Choisy,357,ヒルガオ科,Convolvulaceae,,ヒルガオ科
4392,f,ミドリネナシカズラ,,Cuscuta japonica Choisy f. viridicaulis (Honda) Sugim.,357,ヒルガオ科,Convolvulaceae,,ヒルガオ科
4393,,アオイゴケ,,Dichondra micrantha Urb.,357,ヒルガオ科,Convolvulaceae,,ヒルガオ科
4394,,ホルトカズラ,,Erycibe henryi Prain,357,ヒルガオ科,Convolvulaceae,,ヒルガオ科
4395,,アサガオガラクサ,,Evolvulus alsinoides (L.) L. var. decumbens (R.Br.) Ooststr.,357,ヒルガオ科,Convolvulaceae,,ヒルガオ科
4396,,マルバアサガオガラクサ,,Evolvulus alsinoides (L.) L. var. rotundifolius (Yamam.) Hayata ex Ooststr.,357,ヒルガオ科,Convolvulaceae,,ヒルガオ科
4397,,シロガネガラクサ,,Evolvulus boninensis F.Maek. et Tuyama,357,ヒルガオ科,Convolvulaceae,固有,ヒルガオ科
4398,,アツバアサガオ,,Ipomoea imperati (Vahl) Griseb.,357,ヒルガオ科,Convolvulaceae,,ヒルガオ科
4399,,ノアサガオ,,Ipomoea indica (Burm.) Merr.,357,ヒルガオ科,Convolvulaceae,,ヒルガオ科
4400,f,シロバナノアサガオ,,Ipomoea indica (Burm.) Merr. f. albiflora Stone,357,ヒルガオ科,Convolvulaceae,,ヒルガオ科
4401,,ソコベニヒルガオ,,Ipomoea littoralis Blume,357,ヒルガオ科,Convolvulaceae,,ヒルガオ科
4402,,グンバイヒルガオ,,Ipomoea pes-caprae (L.) Sweet,357,ヒルガオ科,Convolvulaceae,,ヒルガオ科
4403,,オオバケアサガオ,,Lepistemon binectariferum (Wall.) Kuntze var. trichocarpum (Gagnep.) Ooststr.,357,ヒルガオ科,Convolvulaceae,,ヒルガオ科
4404,,フウセンアサガオ,,Operculina turpethum (L.) Silva Manso,357,ヒルガオ科,Convolvulaceae,,ヒルガオ科
4405,,オオバハマアサガオ,オニヒルガオ,Stictocardia tiliifolia (Desr.) Hallier f.,357,ヒルガオ科,Convolvulaceae,,ヒルガオ科
4739,,メジロホオズキ,サンゴホオズキ,Lycianthes biflora (Lour.) Bitter,358,ナス科,Solanaceae,,ナス科
4740,,ムニンホオズキ,,Lycianthes boninensis Bitter,358,ナス科,Solanaceae,固有,ナス科
4741,,ヤエヤマメジロホオズキ,,Lycianthes laevis (Dunal) Bitter var. kotoensis (Y.C.Liu et C.H.Ou) T.Yamaz.,358,ナス科,Solanaceae,,ナス科
4742,,クコ,,Lycium chinense Mill.,358,ナス科,Solanaceae,,ナス科
4743,,アツバクコ,ハマクコ,Lycium sandwicense A.Gray,358,ナス科,Solanaceae,,ナス科
4744,,ヤマホオズキ,,Physaliastrum chamaesarachoides (Makino) Makino,358,ナス科,Solanaceae,固有,ナス科
4745,,イガホオズキ,,Physaliastrum echinatum (Yatabe) Makino,358,ナス科,Solanaceae,,ナス科
4746,,アオホオズキ,フジホオズキ,Physaliastrum japonicum (Franch. et Sav.) Honda,358,ナス科,Solanaceae,固有,ナス科
4747,f,タカオホオズキ,,Physaliastrum japonicum (Franch. et Sav.) Honda f. kimurae (Makino) Yonek.,358,ナス科,Solanaceae,固有,ナス科
4748,,ハシリドコロ,,Scopolia japonica Maxim.,358,ナス科,Solanaceae,固有,ナス科
4749,,ヤンバルナスビ,,Solanum erianthum D.Don,358,ナス科,Solanaceae,,ナス科
4750,f,キミノヤマホロシ,,Solanum japonense Nakai f. xanthocarpum H.Hara,358,ナス科,Solanaceae,,ナス科
4751,,ヤマホロシ,ホソバノホロシ,Solanum japonense Nakai var. japonense,358,ナス科,Solanaceae,,ナス科
4752,,タカオホロシ,,Solanum japonense Nakai var. takaoyamense (Makino) H.Hara,358,ナス科,Solanaceae,,ナス科
4753,,オキナワヒヨドリジョウゴ,,Solanum kayamae T.Yamaz.,358,ナス科,Solanaceae,固有,ナス科
4754,f,シロバナヒヨドリジョウゴ,,Solanum lyratum Thunb. f. leucanthum (Nakai) Sugim.,358,ナス科,Solanaceae,,ナス科
4755,f,キミノヒヨドリジョウゴ,,Solanum lyratum Thunb. f. xanthocarpum (Makino) H.Hara,358,ナス科,Solanaceae,,ナス科
4756,,イトホロシ,,Solanum lyratum Thunb. var. filamentosum Hayashi,358,ナス科,Solanaceae,,ナス科
4757,,ヒヨドリジョウゴ,ホロシ,Solanum lyratum Thunb. var. lyratum,358,ナス科,Solanaceae,,ナス科
4758,,ヒロハノヒヨドリジョウゴ,,Solanum lyratum Thunb. var. maruyamanum Honda,358,ナス科,Solanaceae,,ナス科
4759,,ヤイマナスビ,セイバンナスビ,Solanum macaonense Dunal,358,ナス科,Solanaceae,,ナス科
4760,,マルバノホロシ,ナガババルバノホロシ，ヤママルバノホロシ,Solanum maximowiczii Koidz.,358,ナス科,Solanaceae,,ナス科
4761,,オオマルバノホロシ,,Solanum megacarpum Koidz.,358,ナス科,Solanaceae,,ナス科
4762,,イラブナスビ,,Solanum miyakojimense T.Yamaz. et Takushi,358,ナス科,Solanaceae,,ナス科
4763,,イヌホオズキ,,Solanum nigrum L.,358,ナス科,Solanaceae,,ナス科
4764,,テンジクナスビ,シロスズメナスビ,Solanum violaceum Ortega,358,ナス科,Solanaceae,,ナス科
4765,,ハダカホオズキ,,Tubocapsicum anomalum (Franch. et Sav.) Makino var. anomalum,358,ナス科,Solanaceae,,ナス科
4766,,マルバハダカホオズキ,,Tubocapsicum anomalum (Franch. et Sav.) Makino var. obtusum Makino,358,ナス科,Solanaceae,固有,ナス科
4767,,ムニンハダカホオズキ,,Tubocapsicum boninense (Koidz.) Koidz. ex H.Hara,358,ナス科,Solanaceae,固有,ナス科
4004,,ヒトツバタゴ,ナンジャモンジャ,Chionanthus retusus Lindl. et Paxton,364,モクセイ科,Oleaceae,,モクセイ科
4005,,ヤマトレンギョウ,,Forsythia japonica Makino,364,モクセイ科,Oleaceae,固有,モクセイ科
4006,,ショウドシマレンギョウ,,Forsythia togashii H.Hara,364,モクセイ科,Oleaceae,固有,モクセイ科
4007,,ミヤマアオダモ,,Fraxinus apertisquamifera H.Hara,364,モクセイ科,Oleaceae,固有,モクセイ科
4008,,シマトネリコ,タイワンシオジ，タイワントネリコ，タイトウシオジ，ケタイトウシオジ,Fraxinus griffithii C.B.Clarke var. kosyunensis (K.Mori) T.Yamaz.,364,モクセイ科,Oleaceae,,モクセイ科
4009,,シマタゴ,タイワンタゴ,Fraxinus insularis Hemsl.,364,モクセイ科,Oleaceae,,モクセイ科
4010,,トネリコ,タモ，サトトネリコ,Fraxinus japonica Blume ex K.Koch,364,モクセイ科,Oleaceae,固有,モクセイ科
4011,f,ナガミトネリコ,ナガミノトネリコ,Fraxinus japonica Blume ex K.Koch f. intermedia (Nakai) H.Hara,364,モクセイ科,Oleaceae,固有,モクセイ科
4012,f,デワノトネリコ,デワトネリコ,Fraxinus japonica Blume ex K.Koch f. stenocarpa (Koidz.) T.Yamaz.,364,モクセイ科,Oleaceae,固有,モクセイ科
4013,,ケアオダモ,アラゲアオダモ,Fraxinus lanuginosa Koidz.,364,モクセイ科,Oleaceae,,モクセイ科
4014,f,アオダモ,コバノトネリコ,Fraxinus lanuginosa Koidz. f. serrata (Nakai) Murata,364,モクセイ科,Oleaceae,,モクセイ科
4015,f,ビロードアオダモ,ビロウドアオダモ,Fraxinus lanuginosa Koidz. f. veltina (Nakai) Murata,364,モクセイ科,Oleaceae,,モクセイ科
4016,,ツクシトネリコ,"ウラゲオオトネリコ，ヒロハアオダモ, イブキアオダモ",Fraxinus longicuspis Siebold et Zucc. var. latifolia Nakai,364,モクセイ科,Oleaceae,固有,モクセイ科
4017,,ヤマトアオダモ,オオトネリコ,Fraxinus longicuspis Siebold et Zucc. var. longicuspis,364,モクセイ科,Oleaceae,固有,モクセイ科
4018,,ヤチダモ,オクエゾヤチダモ,Fraxinus mandshurica Rupr.,364,モクセイ科,Oleaceae,,モクセイ科
4019,,シオジ,,Fraxinus platypoda Oliv.,364,モクセイ科,Oleaceae,,モクセイ科
4020,f,ヤマシオジ,カイシジノキ,Fraxinus platypoda Oliv. f. nipponica (Koidz.) Yonek.,364,モクセイ科,Oleaceae,固有,モクセイ科
4021,,マルバアオダモ,"ホソバアオダモ，トサトネリコ，コガネアオダモ, コガネヤチダモ",Fraxinus sieboldiana Blume,364,モクセイ科,Oleaceae,,モクセイ科
4022,,オキナワソケイ,,Jasminum superfluum Koidz.,364,モクセイ科,Oleaceae,,モクセイ科
4023,,サイゴクイボタ,サイコクイボタ,Ligustrum ibota Siebold,364,モクセイ科,Oleaceae,固有,モクセイ科
4024,f,キミノネズミモチ,"シロミネズミモチ, シロネズミモチ",Ligustrum japonicum Thunb. f. leucocarpum (Honda) T.Yamanaka,364,モクセイ科,Oleaceae,固有,モクセイ科
4025,f,ケネズミモチ,,Ligustrum japonicum Thunb. f. pubescens (Koidz.) Murata,364,モクセイ科,Oleaceae,,モクセイ科
4026,,ネズミモチ,タマツバキ,Ligustrum japonicum Thunb. var. japonicum,364,モクセイ科,Oleaceae,,モクセイ科
4027,,イワキ,コバノタマツバキ，アマミイボタ,Ligustrum japonicum Thunb. var. spathulatum Mansfeld,364,モクセイ科,Oleaceae,固有,モクセイ科
4028,,オキナワイボタ,コバノオキナワイボタ,Ligustrum liukiuense Koidz.,364,モクセイ科,Oleaceae,固有,モクセイ科
4029,,ムニンネズミモチ,コバナイボタ，ホソバムニンネズミモチ,Ligustrum micranthum Zucc.,364,モクセイ科,Oleaceae,,モクセイ科
4030,f,セッツイボタ,,Ligustrum obtusifolium Siebold et Zucc. f. leiocalyx (Nakai) Murata,364,モクセイ科,Oleaceae,,モクセイ科
4031,f,ビロードイボタ,,Ligustrum obtusifolium Siebold et Zucc. f. velutinum (Blume) Murata,364,モクセイ科,Oleaceae,,モクセイ科
4032,,イボタノキ,コバノイボタ,Ligustrum obtusifolium Siebold et Zucc. var. obtusifolium,364,モクセイ科,Oleaceae,,モクセイ科
4033,,オニイボタ,,Ligustrum obtusifolium Siebold et Zucc. var. regelianum Rehder,364,モクセイ科,Oleaceae,,モクセイ科
4034,f,ケオオバイボタ,,Ligustrum ovalifolium Hassk. f. heterophyllum (Blume) Murata,364,モクセイ科,Oleaceae,固有,モクセイ科
4035,,オカイボタ,,Ligustrum ovalifolium Hassk. var. hisauchii (Makino) Noshiro,364,モクセイ科,Oleaceae,,モクセイ科
4036,,オオバイボタ,,Ligustrum ovalifolium Hassk. var. ovalifolium,364,モクセイ科,Oleaceae,,モクセイ科
4037,,ハチジョウイボタ,,Ligustrum ovalifolium Hassk. var. pacificum (Nakai) M.Mizush.,364,モクセイ科,Oleaceae,固有,モクセイ科
4038,,ヤナギイボタ,ハナイボタ,Ligustrum salicinum Nakai,364,モクセイ科,Oleaceae,,モクセイ科
4039,,トゲイボタ,,Ligustrum tamakii Hatus.,364,モクセイ科,Oleaceae,,モクセイ科
4040,f,エゾイボタ,エゾヤマイボタ,Ligustrum tschonoskii Decne. f. glabrescens (Koidz.) Murata,364,モクセイ科,Oleaceae,,モクセイ科
4041,,ミウライボタ,ケナシキヨズミイボタ,Ligustrum tschonoskii Decne. var. epile Ohwi,364,モクセイ科,Oleaceae,,モクセイ科
4042,,キヨズミイボタ,キヨスミイボタ,Ligustrum tschonoskii Decne. var. kiyozumianum (Nakai) Ohwi,364,モクセイ科,Oleaceae,固有,モクセイ科
4043,,ミヤマイボタ,オクイボタ,Ligustrum tschonoskii Decne. var. tschonoskii,364,モクセイ科,Oleaceae,固有,モクセイ科
