6935,,タチネズミガヤ,,Muhlenbergia hakonensis (Hack.) Makino,106,イネ科,Poaceae/Gramineae,,イネ科
6936,,オオネズミガヤ,アリサンメズミノオ,Muhlenbergia huegelii Trin.,106,イネ科,Poaceae/Gramineae,,イネ科
6937,,ネズミガヤ,,Muhlenbergia japonica Steud.,106,イネ科,Poaceae/Gramineae,,イネ科
6938,,キダチノネズミガヤ,ヤブネズミガヤ,Muhlenbergia ramosa (Hack.) Makino,106,イネ科,Poaceae/Gramineae,固有,イネ科
6939,,ヒロハヌマガヤ,,Neomolinia fauriei (Hack.) Honda,106,イネ科,Poaceae/Gramineae,,イネ科
6940,,タツノヒゲ,,Neomolinia japonica (Franch. et Sav.) Honda,106,イネ科,Poaceae/Gramineae,,イネ科
6941,f,ヨコヤマタツノヒゲ,,Neomolinia japonica (Franch. et Sav.) Honda f. musashiensis (Hiyama) Yonek.,106,イネ科,Poaceae/Gramineae,,イネ科
6942,,エダウチチヂミザサ,,Oplismenus compositus (L.) P.Beauv. var. compositus,106,イネ科,Poaceae/Gramineae,,イネ科
6943,,ダイトンチヂミザサ,タイトンチヂミザサ,Oplismenus compositus (L.) P.Beauv. var. intermedius (Honda) Ohwi,106,イネ科,Poaceae/Gramineae,,イネ科
6944,,アラゲチヂミザサ,,Oplismenus compositus (L.) P.Beauv. var. owatarii (Honda) Ohwi,106,イネ科,Poaceae/Gramineae,,イネ科
6945,,オオバチヂミザサ,,Oplismenus compositus (L.) P.Beauv. var. patens (Honda) Ohwi,106,イネ科,Poaceae/Gramineae,,イネ科
6946,,ホソバチヂミザサ,ナンゴクチヂミザサ,Oplismenus undulatifolius (Ard.) Roem. et Schult. var. imbecillis (R.Br.) Hack.,106,イネ科,Poaceae/Gramineae,,イネ科
6947,,コチヂミザサ,,Oplismenus undulatifolius (Ard.) Roem. et Schult. var. japonicus (Steud.) Koidz.,106,イネ科,Poaceae/Gramineae,,イネ科
6948,,チャボチヂミザサ,,Oplismenus undulatifolius (Ard.) Roem. et Schult. var. microphyllus (Honda) Ohwi,106,イネ科,Poaceae/Gramineae,,イネ科
6949,,チヂミザサ,ケチヂミザサ,Oplismenus undulatifolius (Ard.) Roem. et Schult. var. undulatifolius,106,イネ科,Poaceae/Gramineae,,イネ科
6950,,ヌカキビ,,Panicum bisulcatum Thunb.,106,イネ科,Poaceae/Gramineae,,イネ科
6951,,オオヌカキビ,,Panicum paludosum Roxb.,106,イネ科,Poaceae/Gramineae,,イネ科
6952,,ハイキビ,,Panicum repens L.,106,イネ科,Poaceae/Gramineae,,イネ科
6953,,コゴメビエ,ヌカビエ,Paspalidium distans (Trin.) Hughes,106,イネ科,Poaceae/Gramineae,,イネ科
6954,,スズメノコビエ,,Paspalum scrobiculatum L. var. orbiculare (G.Forst.) Hack.,106,イネ科,Poaceae/Gramineae,,イネ科
6955,,マルミスズメノヒエ,ハイスズメノヒエ,Paspalum scrobiculatum L. var. scrobiculatum,106,イネ科,Poaceae/Gramineae,,イネ科
6956,,ケマルミスズメノヒエ,ハイスズメノヒエ,Paspalum scrobiculatum L. var. velutinum Hack.,106,イネ科,Poaceae/Gramineae,,イネ科
6957,,スズメノヒエ,,Paspalum thunbergii Kunth ex Steud.,106,イネ科,Poaceae/Gramineae,,イネ科
6958,,サワスズメノヒエ,,Paspalum vaginatum Sw.,106,イネ科,Poaceae/Gramineae,,イネ科
6959,,チカラシバ,,Pennisetum alopecuroides (L.) Spreng.,106,イネ科,Poaceae/Gramineae,,イネ科
6960,f,ボウズチカラシバ,,Pennisetum alopecuroides (L.) Spreng. f. anacanthum Hayashi,106,イネ科,Poaceae/Gramineae,,イネ科
6961,f,ベニチカラシバ,,Pennisetum alopecuroides (L.) Spreng. f. erythrochaetum (Ohwi) Ohwi,106,イネ科,Poaceae/Gramineae,,イネ科
6962,f,アオチカラシバ,,Pennisetum alopecuroides (L.) Spreng. f. viridescens (Miq.) Ohwi,106,イネ科,Poaceae/Gramineae,,イネ科
6963,,シマチカラシバ,,Pennisetum sordidum Koidz.,106,イネ科,Poaceae/Gramineae,,イネ科
6964,,アイアシ,ホソバアイアシ,Phacelurus latifolius (Steud.) Ohwi,106,イネ科,Poaceae/Gramineae,,イネ科
6965,,タキキビ,"カシマガヤ, オオタツノヒゲ",Phaenosperma globosum Munro ex Benth.,106,イネ科,Poaceae/Gramineae,,イネ科
6966,,クサヨシ,,Phalaris arundinacea L.,106,イネ科,Poaceae/Gramineae,,イネ科
6967,,ホソボクサヨシ,,Phalaris arundinacea L. var. japonica (Steud.) Hack.,106,イネ科,Poaceae/Gramineae,,イネ科
6968,,ミヤマアワガエリ,,Phleum alpinum L.,106,イネ科,Poaceae/Gramineae,,イネ科
6969,,ヨシ,アシ，キタヨシ,Phragmites australis (Cav.) Trin. ex Steud.,106,イネ科,Poaceae/Gramineae,,イネ科
6970,f,ケヨシ,,Phragmites australis (Cav.) Trin. ex Steud. f. pilifera (Ohwi) H.Hara,106,イネ科,Poaceae/Gramineae,,イネ科
6971,,ツルヨシ,ジシバリ,Phragmites japonicus Steud.,106,イネ科,Poaceae/Gramineae,,イネ科
6972,,セイタカヨシ,セイコノヨシ,Phragmites karka (Retz.) Trin. ex Steud.,106,イネ科,Poaceae/Gramineae,,イネ科
6973,,イネガヤ,,Piptatherum kuoi S.M.Phillips et Z.L.Wu,106,イネ科,Poaceae/Gramineae,,イネ科
6974,f,ネザサ,,Pleioblastus argenteostriatus (Regel) Nakai f. glaber (Makino) Murata,106,イネ科,Poaceae/Gramineae,固有,イネ科
6975,f,ヒメシマダケ,,Pleioblastus chino (Franch. et Sav.) Makino f. elegantissimus (Makino) Muroi et H.Okamura,106,イネ科,Poaceae/Gramineae,固有,イネ科
6976,f,カンサイアズマネザサ,,Pleioblastus chino (Franch. et Sav.) Makino f. lentigiosus (Koidz.) Sad.Suzuki,106,イネ科,Poaceae/Gramineae,固有,イネ科
6977,f,ジョウボウジダケ,トラフアズマ,Pleioblastus chino (Franch. et Sav.) Makino f. nebulosus (Makino) Muroi,106,イネ科,Poaceae/Gramineae,固有,イネ科
6978,,アズマネザサ,"フシゲアズマネザサ，ナヨダケ，ハコネダケ, シナガワザサ",Pleioblastus chino (Franch. et Sav.) Makino var. chino,106,イネ科,Poaceae/Gramineae,固有,イネ科
6979,f,ヤシバダケ,,Pleioblastus chino (Franch. et Sav.) Makino var. gracilis (Makino) Nakai 'Variegatus',106,イネ科,Poaceae/Gramineae,固有,イネ科
6980,,タイミンチク,ツウシチク,Pleioblastus gramineus (Bean) Nakai,106,イネ科,Poaceae/Gramineae,,イネ科
6981,,アラゲネザサ,,Pleioblastus hattorianus Koidz.,106,イネ科,Poaceae/Gramineae,固有,イネ科
6982,,ヒゴメダケ,,Pleioblastus higoensis Makino,106,イネ科,Poaceae/Gramineae,固有,イネ科
6983,,アオネザサ,トヨオカザサ，シラカワザサ,Pleioblastus humilis (Mitford) Nakai,106,イネ科,Poaceae/Gramineae,固有,イネ科
6984,f,カンザキネザサ,,Pleioblastus humilis (Mitford) Nakai f. ohmiensis (Koidz.) Sad.Suzuki,106,イネ科,Poaceae/Gramineae,固有,イネ科
6985,,キボウシノ,,Pleioblastus kodzumae Makino,106,イネ科,Poaceae/Gramineae,固有,イネ科
6986,,コンゴウタケ,アキバザサ,Pleioblastus kongosanensis Makino,106,イネ科,Poaceae/Gramineae,固有,イネ科
6987,,オニネザサ,アワガネザサ,Pleioblastus kongosanensis Makino var. xystrophyllus (Koidz.) Sad.Suzuki,106,イネ科,Poaceae/Gramineae,固有,イネ科
6988,,リュウキュウチク,"ゴザダケザサ, ギョウヨウチク",Pleioblastus linearis (Hack.) Nakai,106,イネ科,Poaceae/Gramineae,固有,イネ科
6989,f,フイリリュウキュウチク,,Pleioblastus linearis (Hack.) Nakai f. albostriatus Muroi,106,イネ科,Poaceae/Gramineae,固有,イネ科
6990,,ヨコハマダケ,,Pleioblastus matsunoi Nakai ex Makino et Nemoto,106,イネ科,Poaceae/Gramineae,固有,イネ科
6991,,シラシマメダケ,,Pleioblastus nabeshimanus Koidz.,106,イネ科,Poaceae/Gramineae,固有,イネ科
6992,,ヒロウザサ,ヤスオカザサ,Pleioblastus nagashima (Mitford) Nakai,106,イネ科,Poaceae/Gramineae,固有,イネ科
6993,f,ユゲネザサ,,Pleioblastus nagashima (Mitford) Nakai f. dokyoanus (Koidz.) Sad.Suzuki,106,イネ科,Poaceae/Gramineae,固有,イネ科
6994,,エチゼンネザサ,,Pleioblastus nagashima (Mitford) Nakai var. koidzumii (Makino ex Koidz.) Sad.Suzuki,106,イネ科,Poaceae/Gramineae,固有,イネ科
6995,,エチゴメダケ,,Pleioblastus pseudosasaoides Sad.Suzuki,106,イネ科,Poaceae/Gramineae,,イネ科
6996,,シブヤザサ,,Pleioblastus shibuyanus Makino ex Nakai,106,イネ科,Poaceae/Gramineae,固有,イネ科
6997,,ケネザサ,サヤゲシブヤザサ,Pleioblastus shibuyanus Makino ex Nakai var. basihirsutus Sad.Suzuki,106,イネ科,Poaceae/Gramineae,固有,イネ科
6998,f,シロシマメダケ,,Pleioblastus simonii (Carri?re) Nakai f. variegatus (Hook.f.) Muroi,106,イネ科,Poaceae/Gramineae,固有,イネ科
6999,f,ウタツメダケ,,Pleioblastus simonii (Carri?re) Nakai f. zigzag Satomi,106,イネ科,Poaceae/Gramineae,,イネ科
7000,f,ハガワリメダケ,,Pleioblastus simonii (Carri?re) Nakai var. heterophyllus (Makino) Nakai,106,イネ科,Poaceae/Gramineae,固有,イネ科
7001,,メダケ,カワタケ,Pleioblastus simonii (Carri?re) Nakai var. simonii,106,イネ科,Poaceae/Gramineae,固有,イネ科
7002,f,ヤマカムロザサ,アオカムロザサ,Pleioblastus viridistriatus (Regel) Makino f. vagans (Gamble) Muroi,106,イネ科,Poaceae/Gramineae,,イネ科
7003,,ミゾイチゴツナギ,,Poa acroleuca Steud. var. acroleuca,106,イネ科,Poaceae/Gramineae,,イネ科
7004,,オキナワミゾイチゴツナギ,,Poa acroleuca Steud. var. ryukyuensis Koba et Tateoka,106,イネ科,Poaceae/Gramineae,,イネ科
7005,,タマミゾイチゴツナギ,,Poa acroleuca Steud. var. submoniliformis Makino,106,イネ科,Poaceae/Gramineae,,イネ科
7006,,アオイチゴツナギ,,Poa alta Hitchc.,106,イネ科,Poaceae/Gramineae,,イネ科
7007,,スズメノカタビラ,,Poa annua L. var. annua,106,イネ科,Poaceae/Gramineae,,イネ科
7008,,ツクシスズメノカタビラ,,Poa crassinervis Honda,106,イネ科,Poaceae/Gramineae,,イネ科
7009,,オニイチゴツナギ,,Poa eminens J.Presl,106,イネ科,Poaceae/Gramineae,,イネ科
7010,,アイヌソモソモ,,Poa fauriei Hack.,106,イネ科,Poaceae/Gramineae,固有,イネ科
7011,,タカネタチイチゴツナギ,,Poa glauca Vahl var. glauca,106,イネ科,Poaceae/Gramineae,,イネ科
7012,,キタダケイチゴツナギ,,Poa glauca Vahl var. kitadakensis (Ohwi) Ohwi,106,イネ科,Poaceae/Gramineae,固有,イネ科
7013,,ハクサンイチゴツナギ,,Poa hakusanensis Hack.,106,イネ科,Poaceae/Gramineae,固有,イネ科
7014,,ナンブソモソモ,,Poa hayachinensis Koidz.,106,イネ科,Poaceae/Gramineae,固有,イネ科
7015,,ヤマミゾイチゴツナギ,フジイチゴツナギ,Poa hisauchii Honda,106,イネ科,Poaceae/Gramineae,,イネ科
7016,,イワテイチゴツナギ,,Poa iwateana Ohwi,106,イネ科,Poaceae/Gramineae,固有,イネ科
7017,,チョウセンタチイチゴツナギ,,Poa kumgansani Ohwi,106,イネ科,Poaceae/Gramineae,,イネ科
7018,,ワタゲソモソモ,,Poa macrocalyx Trautv. et C.A.Mey. var. fallax (Hack.) Ohwi,106,イネ科,Poaceae/Gramineae,,イネ科
7019,,カラフトイチゴツナギ,ザラバナソモソモ,Poa macrocalyx Trautv. et C.A.Mey. var. macrocalyx,106,イネ科,Poaceae/Gramineae,,イネ科
7021,,ムラサキソモソモ,,Poa malacantha Kom. var. malacantha,106,イネ科,Poaceae/Gramineae,,イネ科
7022,,ミヤマイチゴツナギ,タカネイチゴツナギ,Poa malacantha Kom. var. shinanoana (Ohwi) Ohwi,106,イネ科,Poaceae/Gramineae,,イネ科
7020,f,コモチミヤマイチゴツナギ,タカネイチゴツナギ,Poa malacantha Kom. var. shinanoana (Ohwi) Ohwi f. vivipara (Ohwi) Ohwi,106,イネ科,Poaceae/Gramineae,,イネ科
7023,,イトイチゴツナギ,,Poa matsumurae Hack.,106,イネ科,Poaceae/Gramineae,,イネ科
7024,,タチイチゴツナギ,,Poa nemoralis L.,106,イネ科,Poaceae/Gramineae,,イネ科
7025,,オオイチゴツナギ,,Poa nipponica Koidz.,106,イネ科,Poaceae/Gramineae,,イネ科
7026,,オガタチイチゴツナギ,,Poa ogamontana Mochizuki,106,イネ科,Poaceae/Gramineae,固有,イネ科
7027,,ホクセンイチゴツナギ,,Poa pratensis L. subsp. angustifolia (L.) Arcang. var. hatusimae (Ohwi) Ohwi,106,イネ科,Poaceae/Gramineae,,イネ科
7028,,ナガハグサ,ケンタッキーブルーグラス,Poa pratensis L. subsp. pratensis,106,イネ科,Poaceae/Gramineae,,イネ科
7029,,イブキソモソモ,"チシマソモソモ, チシマイチゴツナギ",Poa radula Franch. et Sav.,106,イネ科,Poaceae/Gramineae,,イネ科
7030,,ヒメカラフトイチゴツナギ,,Poa sachalinensis (Koidz.) Honda var. sachalinensis,106,イネ科,Poaceae/Gramineae,,イネ科
7031,,ムラサキエゾソモソモ,,Poa sachalinensis (Koidz.) Honda var. yezoensis Ohwi,106,イネ科,Poaceae/Gramineae,,イネ科
7032,,イチゴツナギ,ザラツキイチゴツナギ，チョウセンイチゴツナギ,Poa sphondylodes Trin. var. sphondylodes,106,イネ科,Poaceae/Gramineae,,イネ科
7033,,ヒロハイチゴツナギ,,Poa sphondylodes Trin. var. subtrivialis Ohwi,106,イネ科,Poaceae/Gramineae,,イネ科
7034,,ホソバナソモソモ,,Poa tatewakiana Ohwi,106,イネ科,Poaceae/Gramineae,固有,イネ科
7035,,ムカゴツヅリ,,Poa tuberifera Faurie ex Hack.,106,イネ科,Poaceae/Gramineae,固有,イネ科
7036,,タニイチゴツナギ,,Poa yatsugatakensis Honda,106,イネ科,Poaceae/Gramineae,固有,イネ科
7037,,イタチガヤ,,Pogonatherum crinitum (Thunb.) Kunth,106,イネ科,Poaceae/Gramineae,,イネ科
7038,,ヒエガエリ,,Polypogon fugax Nees ex Steud.,106,イネ科,Poaceae/Gramineae,,イネ科
7039,,ハマヒエガエリ,,Polypogon monspeliensis (L.) Desf.,106,イネ科,Poaceae/Gramineae,,イネ科
7040,,ウキシバ,,Pseudoraphis sordida (Thwaites) S.M.Phillips et S.L.Chen,106,イネ科,Poaceae/Gramineae,,イネ科
7041,,ヤダケ,,Pseudosasa japonica (Siebold et Zucc. ex Steud.) Makino ex Nakai,106,イネ科,Poaceae/Gramineae,固有,イネ科
7042,f,キシマヤダケ,,Pseudosasa japonica (Siebold et Zucc. ex Steud.) Makino ex Nakai 'Flavo-variegata',106,イネ科,Poaceae/Gramineae,固有,イネ科
7043,f,ラッキョウヤダケ,,Pseudosasa japonica (Siebold et Zucc. ex Steud.) Makino ex Nakai 'Tsutsumiana',106,イネ科,Poaceae/Gramineae,,イネ科
7044,,ヤクシマダケ,ヤクシマヤダケ,Pseudosasa owatarii (Makino) Makino ex Nakai,106,イネ科,Poaceae/Gramineae,固有,イネ科
7045,,チシマドジョウツナギ,エゾドジョウツナギ,Puccinellia kurilensis (Takeda) Honda,106,イネ科,Poaceae/Gramineae,,イネ科
7046,,タチドジョウツナギ,,Puccinellia nipponica Ohwi,106,イネ科,Poaceae/Gramineae,,イネ科
7047,,ワセオバナ,,Saccharum spontaneum L. var. arenicola (Ohwi) Ohwi,106,イネ科,Poaceae/Gramineae,固有,イネ科
7048,,ナンゴクワセオバナ,,Saccharum spontaneum L. var. spontaneum,106,イネ科,Poaceae/Gramineae,,イネ科
7049,h,ムラサキオバナ,,Saccharum x kanashiroi (Ohwi) Ohwi,106,イネ科,Poaceae/Gramineae,,イネ科
7050,,ホソハイヌメリ,,Sacciolepis indica (L.) Chase var. angusta (Trin.) Keng,106,イネ科,Poaceae/Gramineae,,イネ科
7051,,ハイヌメリグサ,ハイヌメリ,Sacciolepis indica (L.) Chase var. indica,106,イネ科,Poaceae/Gramineae,,イネ科
7052,,ヌメリグサ,,Sacciolepis indica (L.) Chase var. oryzetorum (Makino) Ohwi,106,イネ科,Poaceae/Gramineae,,イネ科
7053,,ハラヌメリ,,Sacciolepis myosuroides (R.Br.) A.Camus,106,イネ科,Poaceae/Gramineae,,イネ科
7054,,アキウネマガリ,,Sasa akiuensis (Sad.Suzuki) Sad.Suzuki,106,イネ科,Poaceae/Gramineae,固有,イネ科
7055,,スズタケ,スズ，スズダケ,Sasa borealis (Hack.) Makino et Shibata var. borealis,106,イネ科,Poaceae/Gramineae,固有,イネ科
7056,,ハチジョウスズタケ,ハチジョウスズダケ，ハチジョウスズ,Sasa borealis (Hack.) Makino et Shibata var. viridescens (Nakai) Yonek.,106,イネ科,Poaceae/Gramineae,固有,イネ科
7057,,センダイザサ,オオクマザサ，ミハルザサ，ユキムラザサ,Sasa chartacea (Makino) Makino et Shibata var. chartacea,106,イネ科,Poaceae/Gramineae,固有,イネ科
7058,,ビロードミヤコザサ,ビロウドミヤコザサ,Sasa chartacea (Makino) Makino var. mollis (Nakai) Sad.Suzuki,106,イネ科,Poaceae/Gramineae,固有,イネ科
7059,,ニッコウザサ,ミヤマスズ,Sasa chartacea (Makino) Makino var. nana (Makino) Sad.Suzuki,106,イネ科,Poaceae/Gramineae,固有,イネ科
7060,,アズマミヤコザサ,,Sasa chartacea (Makino) Makino var. simotsukensis Sad.Suzuki,106,イネ科,Poaceae/Gramineae,固有,イネ科
7061,,タンガザサ,,Sasa elegantissima Koidz.,106,イネ科,Poaceae/Gramineae,固有,イネ科
7062,,フゲシザサ,アサヒザサ,Sasa fugeshiensis Koidz.,106,イネ科,Poaceae/Gramineae,固有,イネ科
7063,,ウンゼンザサ,,Sasa gracillima Nakai,106,イネ科,Poaceae/Gramineae,固有,イネ科
7064,,ミヤマクマザサ,タンザワザサ,Sasa hayatae Makino var. hayatae,106,イネ科,Poaceae/Gramineae,固有,イネ科
7065,,シコクザサ,,Sasa hayatae Makino var. hirtella (Nakai) Sad.Suzuki,106,イネ科,Poaceae/Gramineae,固有,イネ科
7066,,クテガワザサ,,Sasa heterotricha Koidz. var. heterotricha,106,イネ科,Poaceae/Gramineae,固有,イネ科
7067,,イヌクテガワザサ,,Sasa heterotricha Koidz. var. nagatoensis Sad.Suzuki,106,イネ科,Poaceae/Gramineae,固有,イネ科
7068,,オヌカザサ,,Sasa hibaconuca Koidz.,106,イネ科,Poaceae/Gramineae,固有,イネ科
7069,,ミクラザサ,,Sasa jotanii (Kenji Inoue et Tanim.) M.Kobay.,106,イネ科,Poaceae/Gramineae,固有,イネ科
7070,,カガミナンブスズ,"オジハタコスズ, ヨナイナンブスズ",Sasa kagamiana Makino et Uchida,106,イネ科,Poaceae/Gramineae,固有,イネ科
7071,,アリマコスズ,,Sasa kagamiana Makino et Uchida subsp. yoshinoi (Koidz.) Sad.Suzuki,106,イネ科,Poaceae/Gramineae,固有,イネ科
7072,,コガシザサ,ユカワザサ,Sasa kogasensis Nakai,106,イネ科,Poaceae/Gramineae,固有,イネ科
7073,,ナスノユカワザサ,,Sasa kogasensis Nakai var. nasuensis (Kimura et Sad.Suzuki) Sad.Suzuki,106,イネ科,Poaceae/Gramineae,固有,イネ科
7074,,サヤゲチシマザサ,サヤゲアオネマガリ,Sasa kurilensis (Rupr.) Makino et Shibata var. hirta (Koidz.) Sad.Suzuki,106,イネ科,Poaceae/Gramineae,固有,イネ科
7075,,チシマザサ,ネマガリタケ，エチゴザサ,Sasa kurilensis (Rupr.) Makino et Shibata var. kurilensis,106,イネ科,Poaceae/Gramineae,,イネ科
7076,,ナガバネマガリ,ナガバネマガリダケ,Sasa kurilensis (Rupr.) Makino et Shibata var. uchidae (Makino) Makino,106,イネ科,Poaceae/Gramineae,固有,イネ科
7077,,ケマキヤマザサ,,Sasa maculata Nakai var. abei Sad.Suzuki,106,イネ科,Poaceae/Gramineae,固有,イネ科
7078,,マキヤマザサ,,Sasa maculata Nakai var. maculata,106,イネ科,Poaceae/Gramineae,固有,イネ科
7079,,セトウチコスズ,,Sasa magnifica (Nakai) Sad.Suzuki subsp. fujitae Sad.Suzuki,106,イネ科,Poaceae/Gramineae,固有,イネ科
7080,,イッショウチザサ,アヤマナンブスズ,Sasa magnifica (Nakai) Sad.Suzuki subsp. magnifica,106,イネ科,Poaceae/Gramineae,固有,イネ科
7081,,オオバザサ,ホロマンザサ,Sasa megalophylla Makino et Uchida,106,イネ科,Poaceae/Gramineae,,イネ科
7082,f,キンタイオオバザサ,,Sasa megalophylla Makino et Uchida f. aureovariegata Sad.Suzuki,106,イネ科,Poaceae/Gramineae,,イネ科
7083,,ミアケザサ,,Sasa miakeana Sad.Suzuki,106,イネ科,Poaceae/Gramineae,固有,イネ科
7084,,アワノミネザサ,,Sasa minensis Sad.Suzuki var. awaensis Sad.Suzuki,106,イネ科,Poaceae/Gramineae,固有,イネ科
7085,,ミネザサ,,Sasa minensis Sad.Suzuki var. minensis,106,イネ科,Poaceae/Gramineae,固有,イネ科
7086,,ミヤコザサ,イトザサ，ナンダイミヤコザサ，フシゲミヤコザサ,Sasa nipponica (Makino) Makino et Shibata,106,イネ科,Poaceae/Gramineae,固有,イネ科
7087,,サイゴクザサ,,Sasa occidentalis Sad.Suzuki,106,イネ科,Poaceae/Gramineae,固有,イネ科
7088,,ケナシカシダザサ,"コウベコスズ, エダウチコザサ",Sasa oshidensis Makino et Uchida subsp. glabra (Koidz.) Sad.Suzuki,106,イネ科,Poaceae/Gramineae,固有,イネ科
7089,,オオシダザサ,,Sasa oshidensis Makino et Uchida subsp. oshidensis,106,イネ科,Poaceae/Gramineae,固有,イネ科
7090,,シガザサ,,Sasa oshidensis Makino et Uchida var. shigaensis (Koidz.) Sad.Suzuki,106,イネ科,Poaceae/Gramineae,固有,イネ科
7091,,ルベシベザサ,ルベシザサ,Sasa palmata (Lat.-Marl. ex Burb.) E.G.Camus var. niijimae (Tatew. ex Nakai) Sad.Suzuki,106,イネ科,Poaceae/Gramineae,,イネ科
7092,,チマキザサ,フシゲサトチマキ,Sasa palmata (Lat.-Marl. ex Burb.) E.G.Camus var. palmata,106,イネ科,Poaceae/Gramineae,,イネ科
7093,,ヨサチマキ,,Sasa palmata (Lat.-Marl. ex Burb.) E.G.Camus var. yosaensis (Koidz.) Sad.Suzuki,106,イネ科,Poaceae/Gramineae,固有,イネ科
7094,,ケザサ,,Sasa pubens Nakai,106,イネ科,Poaceae/Gramineae,固有,イネ科
7095,,オモエザサ,イブリザサ,Sasa pubiculmis Makino,106,イネ科,Poaceae/Gramineae,固有,イネ科
7096,,ミカワザサ,ツバメザサ,Sasa pubiculmis Makino subsp. sugimotoi (Nakai) Sad.Suzuki,106,イネ科,Poaceae/Gramineae,固有,イネ科
7097,,ウツクシザサ,フシゲウツクシザサ,Sasa pulcherrima Koidz.,106,イネ科,Poaceae/Gramineae,固有,イネ科
7098,,アポイザサ,ケミヤコザサ，シダミヤコザサ，フシゲアポイザサ,Sasa samaniana Nakai var. samaniana,106,イネ科,Poaceae/Gramineae,固有,イネ科
7099,,ビッチュウミヤコザサ,"シダミヤコザサ, ナスノミヤコザサ",Sasa samaniana Nakai var. yoshinoi (Koidz.) Sad.Suzuki,106,イネ科,Poaceae/Gramineae,固有,イネ科
7100,,イヌトクガワザサ,フシゲイブキザサ,Sasa scytophylla Koidz.,106,イネ科,Poaceae/Gramineae,固有,イネ科
7101,f,キンタイザサ,,Sasa senanensis (Franch. et Sav.) Rehder f. nobilis (Makino et Uchida) Sad.Suzuki,106,イネ科,Poaceae/Gramineae,,イネ科
7102,,ミナカミザサ,フシゲミナカミザサ,Sasa senanensis (Franch. et Sav.) Rehder var. harae (Nakai) Sad.Suzuki,106,イネ科,Poaceae/Gramineae,,イネ科
7103,,クマイザサ,"フシゲクマイザサ, シナノザサ",Sasa senanensis (Franch. et Sav.) Rehder var. senanensis,106,イネ科,Poaceae/Gramineae,,イネ科
7104,,ウスバザサ,,Sasa septentrionalis Makino var. membranacea (Makino et Uchida) Sad.Suzuki,106,イネ科,Poaceae/Gramineae,固有,イネ科
7105,,ミヤマザサ,"クザカイザサ, オクミヤコザサ",Sasa septentrionalis Makino var. septentrionalis,106,イネ科,Poaceae/Gramineae,固有,イネ科
7106,,カシダザサ,ツクバコスズ，アサギシザサ,Sasa shimidzuana Makino subsp. kashidensis (Makino ex Koidz.) Sad.Suzuki,106,イネ科,Poaceae/Gramineae,固有,イネ科
7107,,ハコネナンブスズ,"アサギシザサ，ナンブスズ, ハコネスズ",Sasa shimidzuana Makino subsp. shimidzuana,106,イネ科,Poaceae/Gramineae,固有,イネ科
7108,,ケスズ,イシヅチスズ,Sasa sikokiana Koidz.,106,イネ科,Poaceae/Gramineae,固有,イネ科
7109,,オクヤマザサ,,Sasa spiculosa (F.Schmidt) Makino,106,イネ科,Poaceae/Gramineae,,イネ科
7110,,サイヨウザサ,,Sasa stenophylla Koidz. subsp. stenophylla,106,イネ科,Poaceae/Gramineae,固有,イネ科
7111,,ヒメカミザサ,,Sasa stenophylla Koidz. subsp. tobagenzoana (Koidz.) Sad.Suzuki,106,イネ科,Poaceae/Gramineae,固有,イネ科
7112,,アサカネマガリ,,Sasa subvillosa Sad.Suzuki,106,イネ科,Poaceae/Gramineae,固有,イネ科
7113,,カワウチザサ,,Sasa suzukii Nakai,106,イネ科,Poaceae/Gramineae,固有,イネ科
7114,,キリシマザサ,キリシマスズ，オオサキザサ,Sasa takizawana Makino et Uchida subsp. nakashimana (Koidz.) Sad.Suzuki,106,イネ科,Poaceae/Gramineae,固有,イネ科
7115,,タキザワザサ,オオサキザサ,Sasa takizawana Makino et Uchida subsp. takizawana,106,イネ科,Poaceae/Gramineae,固有,イネ科
7116,,オオバネマガリ,,Sasa tatewakiana Makino var. muroiana (Koidz.) Sad.Suzuki,106,イネ科,Poaceae/Gramineae,固有,イネ科
7117,,エゾミヤマザサ,,Sasa tatewakiana Makino var. tatewakiana,106,イネ科,Poaceae/Gramineae,固有,イネ科
7118,,ナンブスズ,,Sasa togashiana Makino,106,イネ科,Poaceae/Gramineae,固有,イネ科
7119,f,キシマナンブスズ,,Sasa togashiana Makino f. flavovariegata Uchida,106,イネ科,Poaceae/Gramineae,固有,イネ科
7120,,トクガワザサ,,Sasa tokugawana Makino,106,イネ科,Poaceae/Gramineae,固有,イネ科
7121,,イヨイブキザサ,,Sasa tsuboiana Makino var. iyomontana Sad.Suzuki,106,イネ科,Poaceae/Gramineae,固有,イネ科
7122,,イブキザサ,ツボイザサ，アマギザサ,Sasa tsuboiana Makino var. tsuboiana,106,イネ科,Poaceae/Gramineae,固有,イネ科
7123,,アシカガコスズ,イナコスズ,Sasa tsukubensis Nakai subsp. pubifolia (Koidz.) Sad.Suzuki,106,イネ科,Poaceae/Gramineae,固有,イネ科
7124,,ツクバナンブスズ,"ツクバザサ，キンキナンブスズ, ヨナイナンブスズ",Sasa tsukubensis Nakai subsp. tsukubensis,106,イネ科,Poaceae/Gramineae,固有,イネ科
7125,,オオササ,"フシゲオオササ, オオザサ",Sasa veitchii (Carri?re) Rehder var. grandifolia (Koidz.) Sad.Suzuki,106,イネ科,Poaceae/Gramineae,固有,イネ科
7126,,チュウゴクザサ,,Sasa veitchii (Carri?re) Rehder var. tyugokensis (Makino) Sad.Suzuki,106,イネ科,Poaceae/Gramineae,,イネ科
7127,,クマザサ,フシゲクマザサ,Sasa veitchii (Carri?re) Rehder var. veitchii ,106,イネ科,Poaceae/Gramineae,固有,イネ科
7128,,シコタンザサ,,Sasa yahikoensis Makino var. depauperata (Takeda) Sad.Suzuki,106,イネ科,Poaceae/Gramineae,,イネ科
7129,,オゼザサ,モガミザサ,Sasa yahikoensis Makino var. oseana (Makino) Sad.Suzuki,106,イネ科,Poaceae/Gramineae,,イネ科
7130,,イワテザサ,,Sasa yahikoensis Makino var. rotundissima (Makino et Uchida) Sad.Suzuki,106,イネ科,Poaceae/Gramineae,固有,イネ科
