2482,,ツゲモドキ,モチツゲ，タイワンツゲモドキ,Putranjiva matsumurae Koidz.,198,ツゲモドキ科,Putranjivaceae,固有,トウダイグサ科
2935,,イイギリ,,Idesia polycarpa Maxim.,201,ヤナギ科,Salicaceae,,イイギリ科
2936,f,シロミイイギリ,,Idesia polycarpa Maxim. f. albobaccata (Ito) H.Hara,201,ヤナギ科,Salicaceae,,イイギリ科
8,,ドロノキ,"ドロヤナギ, デロ, コウアンドロ",Populus suaveolens Fisch.,201,ヤナギ科,Salicaceae,,ヤナギ科
9,,エゾヤマナラシ,"チョウセンヤマナラシ, カラフトヤマナラシ, ナガバチョウセンヤマナラシ, ケチョウセンヤマナラシ",Populus tremula L. var. davidiana (Dode) C.K.Schneid.,201,ヤナギ科,Salicaceae,,ヤナギ科
10,,ヤマナラシ,ハコヤナギ,Populus tremula L. var. sieboldii (Miq.) Kud?,201,ヤナギ科,Salicaceae,固有,ヤナギ科
11,,ケショウヤナギ,カラフトクロヤナギ,Salix arbutifolia Pall.,201,ヤナギ科,Salicaceae,,ヤナギ科
12,,バッコヤナギ,"ヤマネコヤナギ, マルバノバッコヤナギ, エゾノバッコヤナギ, コウライバッコヤナギ, マンシュウバッコヤナギ, ナガバノバッコヤナギ",Salix caprea L.,201,ヤナギ科,Salicaceae,固有,ヤナギ科
13,h,ドアイヤナギ,,Salix caprea L. x S. hukaoana Kimura,201,ヤナギ科,Salicaceae,,ヤナギ科
14,,トカチヤナギ,"カラフトオオバヤナギ, ヒロハタチヤナギ",Salix cardiophylla Trautv. et C.A.Mey. var. cardiophylla,201,ヤナギ科,Salicaceae,,ヤナギ科
15,,オオバヤナギ,,Salix cardiophylla Trautv. et C.A.Mey. var. urbaniana (Seemen) Kud?,201,ヤナギ科,Salicaceae,,ヤナギ科
16,,マルバヤナギ,"アカメヤナギ, ケアカメヤナギ",Salix chaenomeloides Kimura,201,ヤナギ科,Salicaceae,固有,ヤナギ科
17,,シロヤナギ,"エゾシロヤナギ, ミチノクシロヤナギ",Salix dolichostyla Seemen subsp. dolichostyla,201,ヤナギ科,Salicaceae,固有,ヤナギ科
18,,コゴメヤナギ,,Salix dolichostyla Seemen subsp. serissifolia (Kimura) H.Ohashi et H.Nakai,201,ヤナギ科,Salicaceae,固有,ヤナギ科
19,f,シダレコゴメヤナギ,,Salix dolichostyla Seemen subsp. serissifolia (Kimura) H.Ohashi et H.Nakai f. pendula (Okuhara) H.Ohashi et H.Nakai,201,ヤナギ科,Salicaceae,,ヤナギ科
20,,ジャヤナギ,オオシロヤナギ,Salix eriocarpa Franch. et Sav.,201,ヤナギ科,Salicaceae,固有,ヤナギ科
21,,ミヤマヤチヤナギ,ヤチマメヤナギ,Salix fuscescens Andersson,201,ヤナギ科,Salicaceae,固有,ヤナギ科
22,,オオキツネヤナギ,"オオネコヤナギ, キンメヤナギ",Salix futura Seemen,201,ヤナギ科,Salicaceae,固有,ヤナギ科
23,f,アカゲオオキツネヤナギ,,Salix futura Seemen f. rufa (Kimura) H.Ohashi,201,ヤナギ科,Salicaceae,,ヤナギ科
24,f,タチネコヤナギ,,Salix gracilistyla Miq. f. adscendens (Kimura) H.Ohashi,201,ヤナギ科,Salicaceae,,ヤナギ科
25,ｆ,ハイネコヤナギ,シダレネコヤナギ,Salix gracilistyla Miq. f. pendula (Kimura) H.Ohashi,201,ヤナギ科,Salicaceae,,ヤナギ科
26,,チョウセンネコヤナギ,,Salix gracilistyla Miq. var. graciliglans (Nakai) H.Ohashi,201,ヤナギ科,Salicaceae,,ヤナギ科
27,,ネコヤナギ,タチネコヤナギ,Salix gracilistyla Miq. var. gracilistyla,201,ヤナギ科,Salicaceae,,ヤナギ科
28,,ユビソヤナギ,,Salix hukaoana Kimura,201,ヤナギ科,Salicaceae,固有,ヤナギ科
29,,イヌコリヤナギ,,Salix integra Thunb.,201,ヤナギ科,Salicaceae,,ヤナギ科
30,,シバヤナギ,,Salix japonica Thunb.,201,ヤナギ科,Salicaceae,固有,ヤナギ科
31,,カワヤナギ,,Salix miyabeana Seemen subsp. gymnolepis (H.L?v. et Vaniot) H.Ohashi et Yonek. ,201,ヤナギ科,Salicaceae,固有,ヤナギ科
32,,エゾノカワヤナギ,,Salix miyabeana Seemen subsp. myabeana,201,ヤナギ科,Salicaceae,固有,ヤナギ科
33,f,ケタカネイワヤナギ,,Salix nakamurana Koidz. f. eriocarpa (Kimura) T.Shimizu,201,ヤナギ科,Salicaceae,,ヤナギ科
34,f,ホソバタカネイワヤナギ,,Salix nakamurana Koidz. f. stenophylla (Kimura) Kimura,201,ヤナギ科,Salicaceae,,ヤナギ科
35,,ヒダカミネヤナギ,"ハイヤナギ, ジンヨウチシマヤナギ",Salix nakamurana Koidz. subsp. kurilensis (Koidz.) H.Ohashi,201,ヤナギ科,Salicaceae,固有,ヤナギ科
36,,レンゲイワヤナギ,"タカネイワヤナギ, オオマルバヤナギ",Salix nakamurana Koidz. subsp. nakamurana,201,ヤナギ科,Salicaceae,固有,ヤナギ科
37,,エゾノタカネヤナギ,"マルバヤナギ, オオマルバヤナギ, ホソマルバヤナギ",Salix nakamurana Koidz. subsp. yezoalpina (Koidz.) H.Ohashi,201,ヤナギ科,Salicaceae,固有,ヤナギ科
38,f,イヌマルバヤナギ,,Salix nakamurana Koidz. subsp. yezoalpina (Koidz.) H.Ohashi f. neoreticulata (Nakai) H.Ohashi,201,ヤナギ科,Salicaceae,固有,ヤナギ科
39,,エゾマメヤナギ,"ナガバエゾマメヤナギ, マルバエゾマメヤナギ, マメヤナギ",Salix nummularia Andersson,201,ヤナギ科,Salicaceae,固有,ヤナギ科
40,f,キヌゲエゾマメヤナギ,ケエゾノマメヤナギ,Salix nummularia Andersson f. hebecarpa (Kimura) Kimura,201,ヤナギ科,Salicaceae,固有,ヤナギ科
41,,オオタチヤナギ,コガネヤナギ、コウライヤナギ,Salix pierotii Miq.,201,ヤナギ科,Salicaceae,固有,ヤナギ科
42,,テリハヤナギ,"エトロフヤナギ, イヌテリハヤナギ",Salix pseudopentandra (Flod.) Flod.,201,ヤナギ科,Salicaceae,,ヤナギ科
43,,ミヤマヤナギ,"ミネヤナギ, マルバミネヤナギ, ミチノクマルバミネヤナギ, シコタンヤナギ",Salix reinii Franch. et Sav. ex Seemen,201,ヤナギ科,Salicaceae,,ヤナギ科
44,f,キヌゲミヤマヤナギ,"ケミヤマヤナギ, エゾミヤマヤナギ",Salix reinii Franch. et Sav. ex Seemen f. eriocarpa (Kimura) Sugim.,201,ヤナギ科,Salicaceae,固有,ヤナギ科
45,,エゾヤナギ,,Salix rorida Laksch.,201,ヤナギ科,Salicaceae,,ヤナギ科
46,f,コエゾヤナギ,,Salix rorida Laksch. f. roridiformis (Nakai) Kimura ex H.Ohashi,201,ヤナギ科,Salicaceae,,ヤナギ科
47,,コマイワヤナギ,"イワヤナギ, カイノイワヤナギ",Salix rupifraga Koidz.,201,ヤナギ科,Salicaceae,固有,ヤナギ科
48,f,ケコマイワヤナギ,,Salix rupifraga Koidz. f. eriocarpa (Kimura) Kimura ex H.Ohashi,201,ヤナギ科,Salicaceae,,ヤナギ科
49,,エゾノキヌヤナギ,タイリクキヌヤナギ，ホソバキヌヤナギ，チャボキヌヤナギ,Salix schwerinii E.L.Wolf,201,ヤナギ科,Salicaceae,,ヤナギ科
50,,チチブヤナギ,,Salix shiraii Seemen var. kenoensis (Koidz.) Sugim.,201,ヤナギ科,Salicaceae,固有,ヤナギ科
51,,シライヤナギ,,Salix shiraii Seemen var. shiraii,201,ヤナギ科,Salicaceae,固有,ヤナギ科
52,,サツマヤナギ,,Salix sieboldiana Blume var. doiana (Koidz.) H.Ohashi et Yonek.,201,ヤナギ科,Salicaceae,固有,ヤナギ科
53,,ヤマヤナギ,"オクヤマヤナギ, ダイセンヤナギ, ツクシヤマヤナギ, ナガホノヤマヤナギ, イワヤナギ",Salix sieboldiana Blume var. sieboldiana,201,ヤナギ科,Salicaceae,固有,ヤナギ科
54,,ノヤナギ,ヒメヤナギ,Salix subopposita Miq.,201,ヤナギ科,Salicaceae,,ヤナギ科
55,,タライカヤナギ,"ヒロハノタライカヤナギ, チョウセンミネヤナギ",Salix taraikensis Kimura,201,ヤナギ科,Salicaceae,,ヤナギ科
56,,タチヤナギ,,Salix triandra L.,201,ヤナギ科,Salicaceae,,ヤナギ科
57,,オノエヤナギ,"カラフトヤナギ, チョウセンオノエヤナギ",Salix udensis Trautv. et C.A.Mey.,201,ヤナギ科,Salicaceae,,ヤナギ科
58,,キツネヤナギ,ミヤマキツネヤナギ,Salix vulpina Andersson,201,ヤナギ科,Salicaceae,,ヤナギ科
59,,サイコクキツネヤナギ,,Salix vulpina Andersson subsp. alopochroa (Kimura) H.Ohashi et Yonek.,201,ヤナギ科,Salicaceae,固有,ヤナギ科
60,f,カンサイキツネヤナギ,,Salix vulpina Andersson subsp. alopochroa (Kimura) H.Ohashi et Yonek. f. psilostachys (Kimura) H.Ohashi et Yonek.,201,ヤナギ科,Salicaceae,固有,ヤナギ科
61,h,トウゲヤナギ,,Salix x algista C.K.Schneid.,201,ヤナギ科,Salicaceae,,ヤナギ科
62,h,ヤマトヤナギ,イシカワヤナギ,Salix x ampherista C.K.Schneid. nothosubsp. yamatoensis (Koidz.) H.Ohashi et Yonek.,201,ヤナギ科,Salicaceae,固有,ヤナギ科
63,h,ハコダテヤナギ,,Salix x ampherista nothosubsp. ampherista C.K.Schneid.,201,ヤナギ科,Salicaceae,,ヤナギ科
64,h,ナガバノネコヤナギ,,Salix x arakiana Koidz.,201,ヤナギ科,Salicaceae,,ヤナギ科
65,h,バッコオオキツネヤナギ,,Salix x arikae H.Ohashi et Yonek.,201,ヤナギ科,Salicaceae,固有,ヤナギ科
66,h,ネコシバヤナギ,,Salix x cremnophila Kimura,201,ヤナギ科,Salicaceae,,ヤナギ科
67,h,シグレヤナギ,,Salix x eriocataphylla Kimura,201,ヤナギ科,Salicaceae,,ヤナギ科
68,h,ナスノシグレヤナギ,,Salix x eriocataphylloides Kimura,201,ヤナギ科,Salicaceae,,ヤナギ科
69,h,カワオノエヤナギ,,Salix x euerata Kimura,201,ヤナギ科,Salicaceae,,ヤナギ科
70,h,ロッコウヤナギ,,Salix x gracilistyloides Kimura,201,ヤナギ科,Salicaceae,固有,ヤナギ科
71,h,イヌバッコヤナギ,,Salix x hachiojiensis Yoshiyama,201,ヤナギ科,Salicaceae,固有,ヤナギ科
72,h,イヌカワヤナギ,カワイヌコリヤナギ,Salix x hapala Kimura,201,ヤナギ科,Salicaceae,,ヤナギ科
73,h,チクゼンヤナギ,,Salix x hatusimae Kimura,201,ヤナギ科,Salicaceae,固有,ヤナギ科
74,h,リュウゾウジヤナギ,,Salix x hayatana Kimura,201,ヤナギ科,Salicaceae,固有,ヤナギ科
75,h,ヒラオヤナギ,,Salix x hiraoana Kimura nothosubsp. hiraoana,201,ヤナギ科,Salicaceae,固有,ヤナギ科
76,h,ツガルヤナギ,,Salix x hiraoana Kimura nothosubsp. tsugaluensis (Koidz.) H.Ohashi et Yonek.,201,ヤナギ科,Salicaceae,固有,ヤナギ科
77,h,フジヤナギ,,Salix x hisauchiana Koidz.,201,ヤナギ科,Salicaceae,固有,ヤナギ科
78,h,イケノヤナギ,,Salix x ikenoana Kimura,201,ヤナギ科,Salicaceae,,ヤナギ科
79,h,イワヒサヤナギ,,Salix x iwahisana Kimura,201,ヤナギ科,Salicaceae,,ヤナギ科
80,h,シバキツネヤナギ,,Salix x japopina Kimura,201,ヤナギ科,Salicaceae,固有,ヤナギ科
81,h,カミコウチヤナギ,,Salix x kamikotica Kimura,201,ヤナギ科,Salicaceae,固有,ヤナギ科
82,h,ミョウジンヤナギ,,Salix x kawamurana Kimura,201,ヤナギ科,Salicaceae,,ヤナギ科
83,h,トヨハラヤナギ,"コイズミヤナギ, バッコオノエヤナギ",Salix x koidzumii Kimura,201,ヤナギ科,Salicaceae,,ヤナギ科
84,h,コイエヤナギ,ヌシロヤナギ,Salix x koiei Kimura,201,ヤナギ科,Salicaceae,,ヤナギ科
85,h,シロシダレヤナギ,,Salix x lasiogyne Seemen nothosubsp. lasiogyne,201,ヤナギ科,Salicaceae,固有,ヤナギ科
86,h,ユウキシダレ,,Salix x lasiogyne Seemen nothosubsp. yuhkii (Kimura) H.Ohashi,201,ヤナギ科,Salicaceae,,ヤナギ科
87,h,オクヤマサルコ,,Salix x matsumurae Seemen,201,ヤナギ科,Salicaceae,,ヤナギ科
88,h,ワケノカワヤナギ,,Salix x mictostemon Kimura,201,ヤナギ科,Salicaceae,固有,ヤナギ科
89,h,ナスノイワヤナギ,,Salix x nasuensis Kimura,201,ヤナギ科,Salicaceae,固有,ヤナギ科
90,h,バッコキヌヤナギ,,Salix x pedionoma Kimura,201,ヤナギ科,Salicaceae,,ヤナギ科
91,h,オオミヤマヤチヤナギ,,Salix x pseudopaludicola Kimura,201,ヤナギ科,Salicaceae,固有,ヤナギ科
92,h,イヌコリシライヤナギ,,Salix x sakaii H.Ohashi et Yonek.,201,ヤナギ科,Salicaceae,固有,ヤナギ科
93,h,サカマキヤナギ,,Salix x sakamakiensis Yoshiyama,201,ヤナギ科,Salicaceae,,ヤナギ科
94,h,センダイヤナギ,,Salix x sendaica Kimura nothosubsp. sendaica,201,ヤナギ科,Salicaceae,固有,ヤナギ科
95,h,コンゴウバッコヤナギ,,Salix x sendaica Kimura nothosubsp. ultima (Koidz.) H.Ohashi et Yonek.,201,ヤナギ科,Salicaceae,固有,ヤナギ科
96,h,フカオヤナギ,,Salix x sigemitui Kimura,201,ヤナギ科,Salicaceae,,ヤナギ科
97,h,コセキヤナギ,,Salix x sirakawensis Kimura,201,ヤナギ科,Salicaceae,固有,ヤナギ科
98,h,スガヤヤナギ,,Salix x sugayana Kimura,201,ヤナギ科,Salicaceae,,ヤナギ科
99,h,スミヨシヤナギ,,Salix x sumiyosensis Kimura,201,ヤナギ科,Salicaceae,,ヤナギ科
100,h,ミヤコヤナギ,,Salix x thaymasta Kimura,201,ヤナギ科,Salicaceae,,ヤナギ科
101,h,ヒタチヤナギ,,Salix x turumatii Kimura,201,ヤナギ科,Salicaceae,,ヤナギ科
102,,ヨシノヤナギ,ウラジロヨシノヤナギ,Salix yoshinoi Koidz.,201,ヤナギ科,Salicaceae,固有,ヤナギ科
2937,,トゲイヌツゲ,,Scolopia oldhamii Hance,201,ヤナギ科,Salicaceae,,イイギリ科
2938,,クスドイゲ,トリトマラズ，コバノクスドイゲ,Xylosma congesta (Lour.) Merr.,201,ヤナギ科,Salicaceae,,イイギリ科
2939,,エゾノタチツボスミレ,イヌスミレ,Viola acuminata Ledeb.,202,スミレ科,Violaceae,,スミレ科
2940,f,シロバナエゾノタチツボスミレ,,Viola acuminata Ledeb. f. alba Moriya,202,スミレ科,Violaceae,,スミレ科
2941,f,ケナシエゾノタチツボスミレ,,Viola acuminata Ledeb. f. glaberrima (H.Hara) Kitam.,202,スミレ科,Violaceae,,スミレ科
2942,,ジンヨウキスミレ,,Viola alliariifolia Nakai,202,スミレ科,Violaceae,固有,スミレ科
2943,,アマミスミレ,,Viola amamiana Hatus.,202,スミレ科,Violaceae,固有,スミレ科
2944,,アワガタケスミレ,,"Viola awagatakensis T.Yamaz., I.Ito et Ageishi",202,スミレ科,Violaceae,固有,スミレ科
2945,,アリアケスミレ,,Viola betonicifolia Sm. var. albescens (Nakai) F.Maek. et T.Hashim.,202,スミレ科,Violaceae,,スミレ科
2946,h,ハリマスミレ,,Viola betonicifolia Sm. var. albescens (Nakai) F.Maek. et T.Hashim. x V. mandshurica W.Becker,202,スミレ科,Violaceae,,スミレ科
2947,,タイワンヤノネスミレ,,Viola betonicifolia Sm. var. betonicifolia,202,スミレ科,Violaceae,,スミレ科
2948,,リュウキュウシロスミレ,エナガスミレ，ヤノネシロバナスミレ,Viola betonicifolia Sm. var. oblongosagittata (Nakai) F.Maek. et T.Hashim.,202,スミレ科,Violaceae,,スミレ科
2949,h,イチキスミレ,,Viola betonicifolia Sm. var. oblongosagittata (Nakai) F.Maek. et T.Hashim. x V. mandshurica W.Becker,202,スミレ科,Violaceae,,スミレ科
2950,f,ジョウエツキバナノコマノツメ,,Viola biflora L. f. glabrifolia Hid.Takah.,202,スミレ科,Violaceae,,スミレ科
2951,,アカイシキバナノコマノツメ,,Viola biflora L. var. akaishiensis Hid.Takah. et Ohba,202,スミレ科,Violaceae,固有,スミレ科
2952,,キバナノコマノツメ,ケタカネスミレ,Viola biflora L. var. biflora,202,スミレ科,Violaceae,,スミレ科
2953,f,シロバナナガバノスミレサイシン,,Viola bissetii Maxim. f. albiflora Nakai ex F.Maek.,202,スミレ科,Violaceae,,スミレ科
2954,,ナガバノスミレサイシン,,Viola bissetii Maxim. var. bissetii,202,スミレ科,Violaceae,固有,スミレ科
2955,,フイリナガバノスミレサイシン,,Viola bissetii Maxim. var. kiusiana Terao,202,スミレ科,Violaceae,固有,スミレ科
2956,h,ナガバノアケボノスミレ,,Viola bissetii Maxim. x V. rossii Hemsl.,202,スミレ科,Violaceae,,スミレ科
2957,,ウスバスミレ,,Viola blandiformis Nakai,202,スミレ科,Violaceae,固有,スミレ科
2958,,ヒメミヤマスミレ,,Viola boissieuana Makino var. boissieuana,202,スミレ科,Violaceae,,スミレ科
2959,,ヤクシマミヤマスミレ,,Viola boissieuana Makino var. pseudoselkirkii (Nakai) Yahara,202,スミレ科,Violaceae,固有,スミレ科
2960,,オオバキスミレ,,Viola brevistipulata (Franch. et Sav.) W.Becker subsp. brevistipulata,202,スミレ科,Violaceae,固有,スミレ科
2961,f,ミヤマキスミレ,,Viola brevistipulata (Franch. et Sav.) W.Becker subsp. brevistipulata f. acuminata (Nakai) S.Watan.,202,スミレ科,Violaceae,固有,スミレ科
2962,f,アラゲキスミレ,,Viola brevistipulata (Franch. et Sav.) W.Becker subsp. brevistipulata f. pubescens (Nakai) F.Maek.,202,スミレ科,Violaceae,,スミレ科
2963,,フチゲオオバキスミレ,キタカミキスミレ,Viola brevistipulata (Franch. et Sav.) W.Becker subsp. brevistipulata var. ciliata M.Kikuchi,202,スミレ科,Violaceae,固有,スミレ科
2964,,ナエバキスミレ,,Viola brevistipulata (Franch. et Sav.) W.Becker subsp. brevistipulata var. kishidae (Nakai) F.Maek. et T.Hashim.,202,スミレ科,Violaceae,固有,スミレ科
2965,,フギレオオバキスミレ,,Viola brevistipulata (Franch. et Sav.) W.Becker subsp. brevistipulata var. laciniata (H.Boissieu) W.Becker,202,スミレ科,Violaceae,固有,スミレ科
2966,,エゾキスミレ,,Viola brevistipulata (Franch. et Sav.) W.Becker subsp. hidakana (Nakai) S.Watan. var. hidakana (Nakai) S.Watan.,202,スミレ科,Violaceae,固有,スミレ科
2968,,フギレキスミレ,,Viola brevistipulata (Franch. et Sav.) W.Becker subsp. hidakana (Nakai) S.Watan. var. incisa (S.Watan.) F.Maek. et T.Hashim.,202,スミレ科,Violaceae,固有,スミレ科
2969,,ケエゾキスミレ,,"Viola brevistipulata (Franch. et Sav.) W.Becker subsp. hidakana (Nakai) S.Watan. var. yezoana Toyok. ex H.Nakai, H.Igarashi et H.Ohashi",202,スミレ科,Violaceae,固有,スミレ科
2970,f,トカチキスミレ,,"Viola brevistipulata (Franch. et Sav.) W.Becker subsp. hidakana (Nakai) S.Watan. var. yezoana Toyok. ex H.Nakai, H.Igarashi et H.Ohashi f. glabra S.Watan.",202,スミレ科,Violaceae,,スミレ科
2967,f,コバナエゾキスミレ,,"Viola brevistipulata (Franch. et Sav.) W.Becker subsp. hidakana (Nakai) S.Watan. var. yezoana Toyok. ex H.Nakai, H.Igarashi et H.Ohashi f. parviflora S.Watan.",202,スミレ科,Violaceae,,スミレ科
2971,,ダイセンキスミレ,,Viola brevistipulata (Franch. et Sav.) W.Becker subsp. minor (Nakai) F.Maek. et T.Hashim.,202,スミレ科,Violaceae,固有,スミレ科
2972,,ナンザンスミレ,,Viola chaerophylloides (Regel) W.Becker var. chaerophylloides,202,スミレ科,Violaceae,,スミレ科
2973,,ヒゴスミレ,,Viola chaerophylloides (Regel) W.Becker var. sieboldiana (Maxim.) Makino,202,スミレ科,Violaceae,固有,スミレ科
2974,h,ヒラツカスミレ,,Viola chaerophylloides (Regel) W.Becker var. sieboldiana (Maxim.) Makino x V. eizanensis Makino,202,スミレ科,Violaceae,,スミレ科
2975,h,アソキクバスミレ,,Viola chaerophylloides (Regel) W.Becker var. sieboldiana (Maxim.) Makino x V. phalacrocarpa Maxim.,202,スミレ科,Violaceae,,スミレ科
2976,h,キクバヒナスミレ,,Viola chaerophylloides (Regel) W.Becker var. sieboldiana (Maxim.) Makino x V. tokubuchiana Makino var. takedana (Makino) F.Maek.,202,スミレ科,Violaceae,,スミレ科
2977,,エゾノアオイスミレ,エゾアオイスミレ，マルバケスミレ，テシオスミレ，ニオイケスミレ,Viola collina Besser,202,スミレ科,Violaceae,,スミレ科
2978,,タイワンコスミレ,タイワンスミレ,Viola confusa Champ. ex Benth.,202,スミレ科,Violaceae,,スミレ科
2979,,クモマスミレ,,Viola crassa Makino subsp. alpicola Hid.Takah.,202,スミレ科,Violaceae,固有,スミレ科
2980,,エゾタカネスミレ,,Viola crassa Makino subsp. borealis Hid.Takah.,202,スミレ科,Violaceae,固有,スミレ科
2981,,タカネスミレ,タカネキスミレ,Viola crassa Makino subsp. crassa,202,スミレ科,Violaceae,固有,スミレ科
2982,,ヤツガタケキスミレ,,Viola crassa Makino subsp. yatsugatakeana Hid.Takah.,202,スミレ科,Violaceae,固有,スミレ科
2983,,ツクシスミレ,ハイスミレ,Viola diffusa Ging.,202,スミレ科,Violaceae,,スミレ科
2984,h,サツマスミレ,,Viola diffusa Ging. x V. verecunda A.Gray,202,スミレ科,Violaceae,,スミレ科
2985,f,シロバナエゾスミレ,,Viola eizanensis (Makino) Makino f. candida Hiyama,202,スミレ科,Violaceae,,スミレ科
2986,,エイザンスミレ,エゾスミレ,Viola eizanensis (Makino) Makino var. eizanensis,202,スミレ科,Violaceae,固有,スミレ科
2987,,ヒトツバエゾスミレ,,Viola eizanensis (Makino) Makino var. simplicifolia (Makino) Makino,202,スミレ科,Violaceae,固有,スミレ科
2988,f,ナルカミスミレ,,Viola eizanensis (Makino) Makino var. simplicifolia Makino f. leucantha Hiyama,202,スミレ科,Violaceae,,スミレ科
2989,h,フギレアカネスミレ,,Viola eizanensis Makino x V. phalacrocarpa Maxim.,202,スミレ科,Violaceae,,スミレ科
2990,h,フギレミヤマスミレ,,Viola eizanensis Makino x V. selkirkii Pursh ex Goldie,202,スミレ科,Violaceae,,スミレ科
2991,h,キレバノジスミレ,,Viola eizanensis Makino x V. yedoensis Makino,202,スミレ科,Violaceae,,スミレ科
2992,,タニマスミレ,カラフトスミレ，オクヤマスミレ，イワスミレ，チシマコマノツメ,Viola epipsiloides A. et D.L?ve,202,スミレ科,Violaceae,,スミレ科
2993,,テリハタチツボスミレ,,Viola faurieana W.Becker,202,スミレ科,Violaceae,固有,スミレ科
2994,f,シロバナテリハタチツボスミレ,,Viola faurieana W.Becker f. albifaurieana E.Hama,202,スミレ科,Violaceae,,スミレ科
2995,h,ヌノベタチツボスミレ,,Viola faurieana W.Becker x V. grypoceras A.Gray,202,スミレ科,Violaceae,,スミレ科
2996,h,テリハナガハシスミレ,,Viola faurieana W.Becker x V. rostrata Pursh,202,スミレ科,Violaceae,,スミレ科
2997,,イソスミレ,セナミスミレ，ケイソスミレ，イソタチツボスミレ,Viola grayi Franch. et Sav.,202,スミレ科,Violaceae,固有,スミレ科
2998,h,エチゴタチツボスミレ,,Viola grayi Franch. et Sav. x V. grypoceras A.Gray,202,スミレ科,Violaceae,,スミレ科
2999,f,シロバナタチツボスミレ,,Viola grypoceras A.Gray f. albiflora Makino,202,スミレ科,Violaceae,,スミレ科
3000,f,ケオトメスミレ,,Viola grypoceras A.Gray f. hemileuca Honda,202,スミレ科,Violaceae,,スミレ科
3001,f,シロバナケタチツボスミレ,,Viola grypoceras A.Gray f. leucantha H.Hara,202,スミレ科,Violaceae,,スミレ科
3002,f,ケタチツボスミレ,,Viola grypoceras A.Gray f. pubescens (Nakai) M.Mizush.,202,スミレ科,Violaceae,,スミレ科
3003,f,オトメスミレ,,Viola grypoceras A.Gray f. purpurellocalcarata (Makino) Hiyama ex F.Maek.,202,スミレ科,Violaceae,,スミレ科
3004,f,サクラタチツボスミレ,,Viola grypoceras A.Gray f. rosipetala Hiyama,202,スミレ科,Violaceae,,スミレ科
3005,f,ミツバタチツボスミレ,,Viola grypoceras A.Gray f. trifolia Nakai,202,スミレ科,Violaceae,,スミレ科
3006,f,アカフタチツボスミレ,,Viola grypoceras A.Gray f. variegata Nakai,202,スミレ科,Violaceae,,スミレ科
3007,f,ミドリケタチツボスミレ,,Viola grypoceras A.Gray f. viridans Hiyama,202,スミレ科,Violaceae,,スミレ科
3008,f,ミドリタチツボスミレ,,Viola grypoceras A.Gray f. viridiflora Makino ex F.Maek.,202,スミレ科,Violaceae,,スミレ科
3009,,コタチツボスミレ,ヤクシマタチツボスミレ，リュウキュウタチツボスミレ,Viola grypoceras A.Gray var. exilis (Miq.) Nakai,202,スミレ科,Violaceae,,スミレ科
3010,f,シロバナコタチツボスミレ,,Viola grypoceras A.Gray var. exilis (Miq.) Nakai f. chionantha F.Maek.,202,スミレ科,Violaceae,,スミレ科
3011,,タチツボスミレ,ヤブスミレ，ミツバタチツボスミレ,Viola grypoceras A.Gray var. grypoceras,202,スミレ科,Violaceae,,スミレ科
3012,,シチトウスミレ,"ツヤスミレ, ヒチトウスミレ",Viola grypoceras A.Gray var. hichitoana (Nakai) F.Maek.,202,スミレ科,Violaceae,固有,スミレ科
3013,f,シロバナツヤスミレ,,Viola grypoceras A.Gray var. hichitoana (Nakai) F.Maek. f. kikuzatoi K.Nakaj.,202,スミレ科,Violaceae,,スミレ科
3014,,ツルタチツボスミレ,,Viola grypoceras A.Gray var. rhizomata (Nakai) Ohwi,202,スミレ科,Violaceae,固有,スミレ科
3015,,ケイリュウタチツボスミレ,,Viola grypoceras A.Gray var. ripensis N.Yamada et M.Okamoto,202,スミレ科,Violaceae,固有,スミレ科
3016,h,ムラカミタチツボスミレ,,Viola grypoceras A.Gray x V. kusanoana Makino,202,スミレ科,Violaceae,,スミレ科
3017,,サクラスミレ,,Viola hirtipes S.Moore,202,スミレ科,Violaceae,,スミレ科
3018,f,ケナシサクラスミレ,,Viola hirtipes S.Moore f. glabra E.Hama,202,スミレ科,Violaceae,,スミレ科
3019,f,ワタゲスミレ,,Viola hirtipes S.Moore f. grisea (Nakai) Hiyama,202,スミレ科,Violaceae,,スミレ科
3020,f,シロバナサクラスミレ,,"Viola hirtipes S.Moore f. lactiflora T.Hashim., nom.nud.",202,スミレ科,Violaceae,,スミレ科
3021,f,ケントクスミレ,,Viola hirtipes S.Moore f. nudipes Hiyama,202,スミレ科,Violaceae,,スミレ科
3022,f,チシオスミレ,,Viola hirtipes S.Moore f. rhodovenia (Nakai) Hiyama ex F.Maek.,202,スミレ科,Violaceae,,スミレ科
3023,h,アルガスミレ,,Viola hirtipes S.Moore x V. mandshurica W.Becker,202,スミレ科,Violaceae,,スミレ科
3024,h,ヤシュウスミレ,,Viola hirtipes S.Moore x V. sieboldii Maxim.,202,スミレ科,Violaceae,,スミレ科
3025,,アオイスミレ,,Viola hondoensis W.Becker et H.Boissieu,202,スミレ科,Violaceae,,スミレ科
3026,,チシマウスバスミレ,ケウスバスミレ,Viola hultenii W.Becker,202,スミレ科,Violaceae,,スミレ科
3027,,ヒメスミレ,ケヒメスミレ，ツクシヒメスミレ，ケツクシヒメスミレ,Viola inconspicua Blume subsp. nagasakiensis (W.Becker) J.C.Wang et T.C.Huang,202,スミレ科,Violaceae,,スミレ科
